title,pubDate,guid
Indice della produzione nelle costruzioni,2022-09-21T10:06:03,115_362
Presenza di problemi nella zona di residenza delle famiglie,2022-09-20T12:39:21,33_291
Titolo di godimento dell'abitazione,2022-09-20T12:35:35,33_290
Spesa per l'abitazione,2022-09-20T12:34:48,33_225
Problemi nell'abitazione,2022-09-20T12:31:45,33_4
Affollamento nell'abitazione,2022-09-20T12:31:04,33_179
Reddito  netto familiare,2022-09-20T12:26:25,32_292
Fonte principale di reddito familiare,2022-09-20T12:25:45,32_223
Giudizio sul reddito minimo per arrivare a fine mese senza difficoltà,2022-09-20T12:12:26,34_220
Giudizio sulla condizione economica percepita,2022-09-20T12:11:43,34_226
Famiglie che hanno  difficoltà nel pagamento di alcune spese,2022-09-20T12:10:44,34_219
Famiglie che non riescono  a risparmiare o a far fronte a spese impreviste,2022-09-20T12:09:21,34_216
Famiglie che non possono permettersi alcune voci di spesa,2022-09-20T12:08:46,34_280
Famiglie che non possono permettersi alcuni beni durevoli,2022-09-20T11:25:17,34_218
Famiglie che considerano un carico pesante alcune spese per l'abitazione o il rimborso di debiti,2022-09-20T11:21:48,34_217
Famiglie con pagamaneti arretrati,2022-09-20T11:17:42,34_215
Ricerca e Sviluppo,2022-09-20T10:05:14,6_20
Produzione industriale in quantità e valore,2022-09-20T04:24:03,115_168
Latte e prodotti lattiero caseari,2022-09-19T11:20:56,101_959
Nic - mensili dal 2016 (base 2015),2022-09-19T10:26:59,167_744
Prezzi delle abitazioni,2022-09-19T10:24:27,143_497
