title,pubDate,guid
Servizi  socio-educativi per la prima infanzia,2021-06-23T09:36:15,47_850
Viaggi per motivo,2021-06-23T08:08:59,68_697
Visite in giornata (escursioni),2021-06-23T07:37:20,68_338
Pernottamenti  in viaggio,2021-06-23T07:36:48,68_357
Viaggi per caratteristiche del viaggiatore,2021-06-23T07:35:38,68_699
Viaggi per caratteristiche del viaggio,2021-06-23T07:34:54,68_698
Persone che hanno viaggiato,2021-06-23T07:33:59,68_356
Persone andate o non andate in vacanza,2021-06-23T07:32:43,68_161
Indice dei nuovi ordinativi e del fatturato dei prodotti industriali - dati mensili,2021-06-22T10:13:15,114_191
