title,pubDate,guid
Capacità degli esercizi ricettivi e Movimento dei clienti negli esercizi ricettivi,2022-09-02T05:08:26,122_54
Aspetti della vita quotidiana,2022-09-02T02:57:10,83_63
Conto economico delle risorse e degli impieghi  e contributi alla crescita del Pil,2022-09-01T11:12:09,163_156
"Valore aggiunto, Redditi da lavoro, Investimenti fissi lordi, Spesa per consumi finali famiglie, Costi e margini",2022-09-01T11:12:02,163_24
Principali aggregati del Prodotto interno lordo (milioni di euro),2022-09-01T11:10:15,163_184
Occupazione per branca di attività,2022-09-01T11:09:59,163_88
