title,pubDate,guid
Indice della produzione industriale,2021-11-10T10:06:44,115_333
Spese degli enti nazionali previdenza e assistenza sociale - S13 (migliaia di euro),2021-11-09T12:47:42,160_755
Enti nazionali di previdenza e assistenza sociale S13 - entrate (migliaia di euro),2021-11-09T12:46:47,160_754
Numero dei dipendenti degli enti nazionali previdenza e assistenza sociale - S13,2021-11-09T12:46:08,160_753
Spese degli enti previdenziali (migliaia di euro),2021-11-09T12:45:08,160_234
Enti previdenziali - entrate (migliaia di euro),2021-11-09T12:44:28,160_235
Numero dei dipendenti degli enti previdenziali,2021-11-09T12:43:53,160_233
Latte e prodotti lattiero caseari,2021-11-08T03:52:24,101_959
