guid,title,pubDate,id
163_156,Conto economico delle risorse e degli impieghi  e contributi alla crescita del Pil,2022-10-31T10:03:39,DCCN_SQCQ
149_319,Tensione contrattuale,2022-10-28T12:08:28,DCSC_RETRCONTR1T
155_318,Retribuzioni contrattuali per tipo di contratto,2022-10-28T12:07:51,DCSC_RETRCONTR1C
155_358,Retribuzioni contrattuali per settore economico (Ateco),2022-10-28T12:07:44,DCSC_RETRATECO1
168_760,Ipca - mensili dal 2001 (base 2015),2022-10-28T11:22:23,DCSP_IPCA1B2015
167_744,Nic - mensili dal 2016 (base 2015),2022-10-28T11:21:37,DCSP_NIC1B2015
145_360,Prezzi alla produzione dell'industria,2022-10-28T10:09:50,DCSC_PREZZPIND_1
145_361,Indici dei costi di costruzione - dati mensili,2022-10-28T10:07:26,DCSC_FABBRESID_1
101_959,Latte e prodotti lattiero caseari,2022-10-28T07:34:03,DCSP_LATTE
