title,pubDate,guid
Clima di fiducia delle imprese,2022-08-26T10:31:54,6_64
Fiducia delle imprese del commercio,2022-08-26T10:20:57,117_266
Fiducia delle imprese servizi,2022-08-26T10:20:52,117_262
Fiducia delle imprese costruzioni,2022-08-26T10:20:46,111_40
Fiducia delle imprese manifatturiere,2022-08-26T10:19:20,111_263
Fiducia dei consumatori,2022-08-26T10:18:20,30_264
Spesa  per interventi e  servizi sociali,2022-08-25T11:23:06,47_940
Servizi  socio-educativi per la prima infanzia,2022-08-25T08:53:50,47_850
